{
  "version": "v5-pair-spec-1",
  "task_id": "fastapi-sse-line-splitting",
  "domain": "protocol",
  "repository": "fastapi/fastapi",
  "revision": "31ce3cb8d73a6e20221315a90dd98a117f0101a0",
  "task_prompt": "Investigate FastAPI SSE event formatting for payloads containing trailing newlines, CRLF/lone CR line endings, and Unicode characters that Python str.splitlines() treats as separators but the SSE protocol does not. Make formatting comply with SSE line-termination semantics and add boundary-focused regression tests for data and comments.",
  "task_prompt_sha256": "0f26db1b35afddaf1456372a9c63f92b76a30b20dca4e0e6abe0cc496acfc2d8",
  "model": "claude-sonnet-5",
  "agent_runtime": "claude-code-cli",
  "tool_profile": "v5-code-bare-v1",
  "repeat_index": 0,
  "pair_id": "fastapi-sse-line-splitting-r0",
  "command": {
    "argv": [
      "{python}",
      "{showmewhy_repo}/evals/v5/claude_adapter.py"
    ],
    "timeout_seconds": 3600,
    "pass_env": []
  }
}
