{
  "version": "v5-pair-spec-1",
  "task_id": "ruff-sim117-mixed-sync-async",
  "domain": "static-analysis",
  "repository": "astral-sh/ruff",
  "revision": "3a8fb30e6fa89b1b334aa77625c364000d602cc5",
  "task_prompt": "Investigate Ruff SIM117 false negatives for nested with statements when a combinable nested pair sits below an incompatible sync/async parent or an exempt context manager. Preserve top-to-bottom fixing for genuinely combinable parents, avoid invalid sync/async combinations, and add regression cases covering the relevant boundaries.",
  "task_prompt_sha256": "92ca8f2bbde2c4deae9ce3188bd2d7f3bc89fd617cf3149eff1ba71bc930fd14",
  "model": "claude-sonnet-5",
  "agent_runtime": "claude-code-cli@2.1.278",
  "tool_profile": "v5-code-bare-v1",
  "repeat_index": 0,
  "pair_id": "ruff-sim117-mixed-sync-async-r0",
  "command": {
    "argv": [
      "{python}",
      "{showmewhy_repo}/evals/v5/claude_adapter.py"
    ],
    "timeout_seconds": 3600,
    "pass_env": []
  }
}
